"","dept","course_num","title","time","dist","semester"
"1249","ethics-politics-economics","PLSC 114","Introduction to Political Philosophy","TTh 11:35am-12:25pm","SO","spring"
"1250","ethics-politics-economics","PLSC 118","The Moral Foundations of Politics","TTh 10:30am-11:20am","SO","fall"
"1251","ethnicity-race-migration","ER&M 200","Introduction to EthnicityRaceand Migration","not listed","HU","fall"
"1252","ethnicity-race-migration","ER&M 300","Comparative Ethnic Studies","W 1:30pm-3:20pm","SO","spring"
"1253","ethnicity-race-migration","AFAM 060","Significance of American Slavery","MW 1pm-2:15pm","WR","fall"
"1254","ethnicity-race-migration","AFAM 194","African American Arts Today","MW 1pm-2:15pm","HU","spring"
"1255","ethnicity-race-migration","AFAM 349","Civil Rights and Women's Liberation","Th 9:25am-11:15am","HU","spring"
"1256","ethnicity-race-migration","AFAM 383","The Two Congos: Literature and Culture in the Heart of Africa","T 1:30pm-3:20pm","HU","spring"
"1257","ethnicity-race-migration","AFAM 408","African American Poets of the Modern Era","M 1:30pm-3:20pm","HU","fall"
"1258","ethnicity-race-migration","AMST 307","SportsCivil Rightsand American Leadership","M 1:30pm-3:20pm","not specified","spring"
"1259","ethnicity-race-migration","AMST 348","SpacePlaceand Landscape","W 1:30pm-3:20pm","SO","fall"
"1260","ethnicity-race-migration","AMST 483","Urban Public Spaces","T 9:25am-11:15am","SO","fall"
"1261","ethnicity-race-migration","ANTH 237","SmugglingTraffickingand the Criminal Act","HTBA","SO","fall"
"1262","ethnicity-race-migration","ANTH 254","Japan: CultureSocietyModernity","HTBA","WR","fall"
"1263","ethnicity-race-migration","ANTH 366","Anthropology of Inequality in America","W 9:25am-11:15am","SO","fall"
"1264","ethnicity-race-migration","ANTH 386","Humanitarian Interventions: EthicsPoliticsand Health","HTBA","SO","fall"
"1265","ethnicity-race-migration","ANTH 438","CulturePowerOil","HTBA","SO","spring"
"1266","ethnicity-race-migration","ENGL 335","Caribbean Poetry","Th 2:30pm-4:20pm","WR","fall"
"1267","ethnicity-race-migration","EP&E 246","The Politics of Development Assistance","HTBA","SO","fall"
"1268","ethnicity-race-migration","EP&E 323","U.S. Immigration Law and Policy","Th 7pm-8:50pm","SO","spring"
"1269","ethnicity-race-migration","ER&M 017","Travel Literature of the Americas","TTh 2:30pm-3:45pm","not specified","fall"
"1270","ethnicity-race-migration","ER&M 129","Topics in California History","Th 1:30pm-3:20pm","WR","fall"
"1271","ethnicity-race-migration","ER&M 210","Race and Gender in American Literature","TTh 11:35am-12:25pm","WR","spring"
"1272","ethnicity-race-migration","ER&M 219","History of the Jews and Their Diasporas to Early Modern Times","TTh 11:35am-12:50pm","HU","fall"
"1273","ethnicity-race-migration","ER&M 236","Global Fictions","MW 11:35am-12:25pm","WR","fall"
"1274","ethnicity-race-migration","ER&M 264","Sex and Gender in Society","TTh 3:30pm-4:20pm","SO","fall"
"1275","ethnicity-race-migration","ER&M 271","The Rwandan Genocide in Comparative Context","HTBA","SO","spring"
"1276","ethnicity-race-migration","ER&M 278","From West Africa to the Black Americas: The Black Atlantic Visual Tradition","TTh 11:35am-12:50pm","HU","spring"
"1277","ethnicity-race-migration","ER&M 280","Music in Nazi Germany","T 1:30pm-3:20pm","not specified","fall"
"1278","ethnicity-race-migration","ER&M 312","Colonial Visions and Contemporary Revisions","HTBA","HU","spring"
"1279","ethnicity-race-migration","ER&M 313","Nigeria and Its Diaspora","HTBA","SO","spring"
"1280","ethnicity-race-migration","ER&M 314","Urban Latina/o Cultures","W 2:30pm-4:20pm","HU","fall"
"1281","ethnicity-race-migration","ER&M 315","Haitian and Dominican Literature and Culture","W 1:30pm-3:20pm","HU","spring"
"1282","ethnicity-race-migration","ER&M 317","The Politics of Migration","TTh 10:30am-11:20am","SO","fall"
"1283","ethnicity-race-migration","ER&M 323","Modern FamiliesIdentitiesand Cultures in Asia and the United States","MW 1pm-2:15pm","WR","spring"
"1284","ethnicity-race-migration","ER&M 327","Constructing the Self: From Autobiography to Facebook","T 1:30pm-3:20pm","WR","fall"
"1285","ethnicity-race-migration","ER&M 328","Popular Culture and Postcolonial India","W 1:30pm-3:20pm","WR","fall"
"1286","ethnicity-race-migration","ER&M 341","History of Mexico since Independence","TTh 2:30pm-3:45pm","HU","fall"
"1287","ethnicity-race-migration","ER&M 342","Revolutionary Change and Cold War in Latin America","T 1:30pm-3:20pm","WR","fall"
"1288","ethnicity-race-migration","ER&M 362","Genocide and Ethnic Conflict","W 1:30pm-3:20pm","SO","fall"
"1289","ethnicity-race-migration","ER&M 370","Indians and the Spanish Borderlands","HTBA","WR","spring"
"1290","ethnicity-race-migration","ER&M 384","U.S. Border and Immigration Policy","W 1:30pm-3:20pm","SO","spring"
"1291","ethnicity-race-migration","ER&M 413","Fictions of Imaginary and Imminent Futures","W 1:30pm-3:20pm","HU","fall"
"1292","ethnicity-race-migration","ER&M 415","Investigating the Present","M 1:30pm-3:20pm","HU","fall"
"1293","ethnicity-race-migration","ER&M 419","Ethnography of the African American Community","M 1:30pm-3:20pm","SO","fall"
"1294","ethnicity-race-migration","HIST 119","The Civil War and Reconstruction Era1845–1877","TTh 10:30am-11:20am","HU","spring"
"1295","ethnicity-race-migration","HIST 264","Eastern Europe since 1914","TTh 2:30pm-3:20pm","HU","spring"
"1296","ethnicity-race-migration","HIST 303","Japan's Modern Revolution","MW 10:30am-11:20am","HU","spring"
"1297","ethnicity-race-migration","HIST 310","History of Modern South Asia","MW 11:35am-12:25pm","HU","fall"
"1298","ethnicity-race-migration","HIST 323","Southeast Asia since 1900","TTh 11:35am-12:50pm","HU","spring"
"1299","ethnicity-race-migration","HIST 332","African Encounters with Colonialism","MW 11:35am-12:25pm","HU","fall"
"1300","ethnicity-race-migration","HIST 335","A History of South Africa","MW 11:35am-12:25pm","HU","spring"
"1301","ethnicity-race-migration","HIST 362","Cold War in the Third World","T 1:30pm-3:20pm","WR","not specified"
"1302","ethnicity-race-migration","HIST 363","Latin America since Independence","MW 2:30pm-3:20pm","WR","spring"
"1303","ethnicity-race-migration","HIST 377","Freedom and Abolition in Latin America","W 9:25am-11:15am","WR","fall"
"1304","ethnicity-race-migration","HIST 388","Slavery and the Slave Trade in Africa","W 1:30pm-3:20pm","WR","fall"
"1305","ethnicity-race-migration","HSAR 373","African American Art1963 to the Present","MW 10:30am-11:20am","HU","spring"
"1306","ethnicity-race-migration","LITR 143","World Cinema","MW 11:35am-12:50pm","WR","spring"
"1307","ethnicity-race-migration","LITR 338","Representing the Holocaust","TTh 2:30pm-3:45pm","WR","fall"
"1308","ethnicity-race-migration","LITR 417","Maps and the Western Literary Imagination","T 2:30pm-4:20pm","HU","fall"
"1309","ethnicity-race-migration","PLSC 225","Policing in America","W 3:30pm-5:20pm","SO","fall"
"1310","ethnicity-race-migration","PLSC 240","Public Schools and Public Policy","Th 3:30pm-5:30pm","SO","spring"
"1311","ethnicity-race-migration","PLSC 245","Urban Politics and Policy","Th 1:30pm-3:20pm","SO","fall"
"1312","ethnicity-race-migration","PLSC 260","Public Schools and Politics","Th 3:30pm-5:20pm","SO","fall"
"1313","ethnicity-race-migration","PLSC 280","PovertyPoliticsand Policy in the American City","W 3:30pm-5:20pm","SO","spring"
"1314","ethnicity-race-migration","PLSC 359","Violence and Civil Strife","HTBA","SO","spring"
"1315","ethnicity-race-migration","PLSC 368","Global Politics","HTBA","SO","spring"
"1316","ethnicity-race-migration","PLSC 436","Violence: State and Society","HTBA","SO","fall"
"1317","ethnicity-race-migration","PORT 394","World Cities and Narratives","T 1:30pm-3:20pm","WR","fall"
"1318","ethnicity-race-migration","SOCY 232","Islamic Social Movements","Th 1:30pm-3:20pm","SO","spring"
"1319","ethnicity-race-migration","SOCY 314","Inequality in America","T 9:25am-11:15am","WR","spring"
"1320","ethnicity-race-migration","SOCY 339","ImperialismInsurgencyand State Building in the Middle East and North Africa","Th 9:25am-11:15am","SO","spring"
"1321","ethnicity-race-migration","ER&M 471","Individual Reading and Research for Juniors and Seniors","HTBA","not specified","fall"
"1322","ethnicity-race-migration","ER&M 491","The Senior Colloquium: Theoretical and Methodological Issues","W 9:25am-11:15am","not specified","fall"
"1323","ethnicity-race-migration","ER&M 492","The Senior Essay or Project","HTBA","not specified","spring"
"1324","film-studies","FILM 150","Introduction to Film Studies","TTh 1:30pm-2:20pm","WR","fall"
"1325","film-studies","FILM 314","Media Archeology","TTh 10:30am-11:20am","not specified","fall"
"1326","film-studies","FILM 320","Close Analysis of Film","T 1:30pm-3:20pm","HU","spring"
"1327","film-studies","FILM 345","Film TheoryCriticismand Culture","TTh 2:30pm-3:20pm; Su 7pm-9:30pm","HU","spring"
"1328","film-studies","FILM 240","World Cinema","MW 11:35am-12:25pm","WR","spring"
"1329","film-studies","FILM 241","Polish Communism and Postcommunism in Film","MW 1pm-2:15pm","HU","spring"
"1330","film-studies","FILM 262","French Cinema","W 1:30pm-3:20pm","L5","fall"
"1331","film-studies","FILM 317","Understanding Bollywood","HTBA","HU","spring"
"1332","film-studies","FILM 335","Classical Hollywood: Art and Industry","MW 10:30am-11:20am","HU","fall"
"1333","film-studies","FILM 363","Radical Cinemas of Latin America","W 7pm-8:50pm","HU","spring"
"1334","film-studies","FILM 389","Crime in Japanese Film and Fiction","MW 2:30pm-3:45pm","HU","spring"
"1335","film-studies","FILM 427","American Documentary Films","M 2:30pm-5:20pm","HU","fall"
"1336","film-studies","FILM 438","U.S. Cinema from 1960 to the Mid-1970s","Th 3:30pm-5:20pm","HU","spring"
"1337","film-studies","FILM 457","Italian Film from Postwar to Postmodern","MW 4pm-5:15pm","HU","spring"
"1338","film-studies","FILM 461","British Cinema","M 1:30pm-3:20pm","HU","spring"
"1339","film-studies","FILM 092","Spectatorship and Visual Culture","TTh 11:35am-12:50pm","not specified","fall"
"1340","film-studies","FILM 244","Media and Medicine in Modern America","TTh 10:30am-11:20am","HU","fall"
"1341","film-studies","FILM 290","Places of Amusement in American Culture","MW 2:30pm-3:20pm","not specified","spring"
"1342","film-studies","FILM 305","History and Theory of Animation","TTh 2:30pm-3:45pm","HU","fall"
"1343","film-studies","FILM 324","Gender and Sexuality in Media and Popular Culture","M 3:30pm-5:20pm","HU","fall"
"1344","film-studies","FILM 346","Intermediality in Film","W 3:30pm-5:20pm","HU","spring"
"1345","film-studies","FILM 356","Medieval Literature in Movies","TTh 9:25am-10:15am","HU","fall"
"1346","film-studies","FILM 357","BooksDisplaysand Systems Theory","T 3:30pm-5:20pm","HU","fall"
"1347","film-studies","FILM 362","Representing the Holocaust","TTh 2:30pm-3:45pm","WR","fall"
"1348","film-studies","FILM 372","Los Angeles Culture and the 1960s","M 1:30pm-3:20pm","HU","fall"
"1349","film-studies","FILM 375","LGBTQ Cinema","W 1:30pm-3:20pm","HU","spring"
"1350","film-studies","FILM 381","The Film Melodrama","W 3:30pm-5:20pm","HU","fall"
"1351","film-studies","FILM 423","Documentary and the Environment","TTh 11:35am-12:50pm","HU","spring"
"1352","film-studies","FILM 444","Sexual Modernity and Censorship in American Film","W 1:30pm-3:20pm","HU","fall"
"1353","film-studies","FILM 469","The Films of Martin Scorsese","Th 3:30pm-5:20pm","HU","fall"
"1354","film-studies","ART 141","Introductory Film Writing and Directing","M 8:25am-12:20pm","not specified","fall"
"1355","film-studies","ART 142","Introductory Documentary Filmmaking","M 1:30pm-5:20pm","not specified","spring"
"1356","film-studies","ART 341","Intermediate Film Writing and Directing","not listed","not specified","both"
"1357","film-studies","ART 342","Intermediate Documentary Filmmaking","TTh 1:30pm-3:20pm","HU","spring"
"1358","film-studies","FILM 350","Screenwriting","Th 3:30pm-5:20pm","not specified","both"
"1359","film-studies","FILM 395","Intermediate Screenwriting","W 7pm-8:50pm","not specified","spring"
"1360","film-studies","FILM 455","Documentary Film Workshop","W 1:30pm-3:20pm","not specified","fall"
"1361","film-studies","FILM 483","Advanced Film Writing and Directing","M 8:25am-12:20pm","not specified","fall"
"1362","film-studies","FILM 487","Advanced Screenwriting","Th 1:30pm-3:20pm","not specified","fall"
"1363","film-studies","FILM 471","Independent Directed Study","HTBA","not specified","both"
"1364","film-studies","FILM 491","The Senior Essay","HTBA","not specified","fall"
"1365","film-studies","FILM 493","The Senior Project","HTBA","not specified","fall"
"1366","forestry-environmental-studies","F&ES 020","Sustainable Development in Haiti","TTh 9am-10:15am","WR","fall"
"1367","forestry-environmental-studies","F&ES 255","Environmental Politics and Law","HTBA","SO","spring"
"1368","forestry-environmental-studies","F&ES 260","StructureFunctionand Development of Vascular Plants","MW 4pm-5:15pm","SC","fall"
"1369","forestry-environmental-studies","F&ES 261","Minerals and Human Health","HTBA","SC","fall"
"1370","forestry-environmental-studies","F&ES 285","Political Ecology: NatureCultureand Power","W 9:25am-11:15am","SO","spring"
"1371","forestry-environmental-studies","F&ES 290","Geographic Information Systems","T 9:25am-11:15am","not specified","spring"
"1372","forestry-environmental-studies","F&ES 307","Organic Pollutants in the Environment","MW 1pm-2:15pm","not specified","fall"
"1373","forestry-environmental-studies","F&ES 315","Conservation Biology","MW 10:30am-11:20am","SC","fall"
"1374","forestry-environmental-studies","F&ES 327","Atmospheric Chemistry","HTBA","QR","fall"
"1375","forestry-environmental-studies","F&ES 344","Aquatic Chemistry","TTh 1pm-2:15pm","SC","spring"
"1376","forestry-environmental-studies","F&ES 384","Environmental Anthropology","Th 9:25am-11:15am","SO","fall"
"1377","forestry-environmental-studies","F&ES 422","Anthropology of Climate ChangePast and Present","Th 2:30pm-4:20pm","SO","fall"
"1378","french","FREN 110","Elementary and Intermediate French I","not listed","L1","fall"
"1379","french","FREN 120","Elementary and Intermediate French II","not listed","L2","spring"
"1380","french","FREN 121","Intermediate French","not listed","L2","both"
"1381","french","FREN 125","Intensive Elementary French","HTBA","L1","fall"
"1382","french","FREN 130","Intermediate and Advanced French I","not listed","L3","both"
"1383","french","FREN 140","Intermediate and Advanced French II","not listed","L4","both"
"1384","french","FREN 145","Intensive Intermediate and Advanced French","HTBA","L3","spring"
"1385","french","FREN 150","Advanced Language Practice","not listed","L5","both"
"1386","french","FREN 160","Advanced Culture and Conversation","not listed","L5","both"
"1387","french","FREN 170","Introduction to the Study of Literature in French","not listed","L5","both"
"1388","french","FREN 195","Advanced Writing Workshop","TTh 1pm-2:15pm","L5","fall"
"1389","french","FREN 198","Applied Advanced French Grammar","TTh 1pm-2:15pm","L5","spring"
"1390","french","FREN 200","Literary Analysis and Theory","MW 11:35am-12:50pm","L5","spring"
"1391","french","FREN 217","The French Renaissance","MF 1pm-2:15pm","L5","spring"
"1392","french","FREN 219","Seventeenth-Century French Literature","MW 2:30pm-3:45pm","L5","fall"
"1393","french","FREN 232","French Fiction since 1800","MW 11:35am-12:50pm","L5","fall"
"1394","french","FREN 255","French Cinema","W 1:30pm-3:20pm","L5","fall"
"1395","french","FREN 270","Mad Poets of the Nineteenth and Twentieth Century","HTBA","WR","fall"
"1396","french","FREN 306","Trains in French Literature and Culture","HTBA","L5","fall"
"1397","french","FREN 366","Writers and Artists in Paris1780–1914","TTh 1pm-2:15pm","L5","fall"
"1398","french","FREN 388","Feminine Voices in French Literature","HTBA","WR","spring"
"1399","french","FREN 416","Contemporary Tales of Social Mobility","HTBA","L5","fall"
"1400","french","FREN 425","North African Poetry in French","HTBA","not specified","spring"
"1401","french","FREN 470","Special Tutorial for Juniors and Seniors","HTBA","not specified","fall"
"1402","french","FREN 491","The Senior Essay","HTBA","not specified","both"
"1403","french","FREN 493","The Senior Essay in the Intensive Major","HTBA","not specified","fall"
"1404","french","FREN 240","The Modern French Novel","TTh 11:35am-12:25pm","HU","spring"
"1405","french","FREN 305","Medieval Biography","HTBA","HU","fall"
"1406","french","FREN 342","French Literary Movements from Romanticism to Decadence","MW 4pm-5:15pm","HU","spring"
"1407","french","FREN 345","The Prose Poem","TTh 9am-10:15am","L5","fall"
"1408","french","FREN 355","Camus and the Postwar Era","HTBA","HU","fall"
"1409","french","FREN 376","The Two Congos: Literature and Culture in the Heart of Africa","T 1:30pm-3:20pm","HU","spring"
"1410","french","FREN 384","Representing the Holocaust","TTh 2:30pm-3:45pm","WR","fall"
"1411","french","FREN 109","French for Reading","not listed","not specified","both"
"1412","freshman-seminar-program","AFAM 010","Twentieth-Century African American Poetry","MW 11:35am-12:50pm","HU","fall"
"1413","freshman-seminar-program","AFAM 060","Significance of American Slavery","MW 1pm-2:15pm","WR","fall"
"1414","freshman-seminar-program","AMST 002","American Consumer Culture in the Twentieth Century","TTh 1pm-2:15pm","WR","spring"
"1415","freshman-seminar-program","AMST 017","Travel Literature of the Americas","TTh 2:30pm-3:45pm","not specified","fall"
"1416","freshman-seminar-program","AMST 019","Commodities as U.S. History","MW 11:35am-12:50pm","not specified","fall"
"1417","freshman-seminar-program","ANTH 011","Reproductive Technologies","HTBA","SO","spring"
"1418","freshman-seminar-program","ANTH 012","Exploring SportSocietyand Culture","HTBA","WR","spring"
"1419","freshman-seminar-program","ANTH 030","Inca Culture and Society","HTBA","SO","spring"
"1420","freshman-seminar-program","ANTH 040","The Evolution of Human Uniqueness","HTBA","SO","spring"
"1421","freshman-seminar-program","APHY 050","Science of Modern Technology","MW 2:30pm-3:45pm","SC","spring"
"1422","freshman-seminar-program","ART 002","Paper","TTh 1pm-2:15pm","not specified","spring"
"1423","freshman-seminar-program","ART 004","Words and Pictures","MW 4pm-5:15pm","HU","fall"
"1424","freshman-seminar-program","ART 005","Interactive Concrete Poetry","HTBA","not specified","fall"
"1425","freshman-seminar-program","ART 006","Art of the Printed Word","HTBA","HU","fall"
"1426","freshman-seminar-program","ASTR 030","Search for Extraterrestrial Life","TTh 4pm-5:15pm","WR","fall"
"1427","freshman-seminar-program","ASTR 040","Expanding Ideas of Time and Space","TTh 11:35am-12:50pm","SC","spring"
"1428","freshman-seminar-program","CLCV 002","The Romans: A Cultural Introduction","HTBA","HU","spring"
"1429","freshman-seminar-program","ENGL 010","Jane Austen","MW 11:35am-12:50pm","WR","spring"
"1430","freshman-seminar-program","ENGL 012","Literary Cities: New YorkChicagoSan Francisco","TTh 2:30pm-3:45pm","WR","fall"
"1431","freshman-seminar-program","ENGL 013","Forms of Communication and Intimacy","TTh 9am-10:15am","WR","spring"
"1432","freshman-seminar-program","ENGL 016","Technomodernism","MW 11:35am-12:50pm","WR","spring"
"1433","freshman-seminar-program","ENGL 033","American Literature in the World","TTh 11:35am-12:50pm","WR","fall"
"1434","freshman-seminar-program","F&ES 020","Sustainable Development in Haiti","TTh 9am-10:15am","WR","fall"
"1435","freshman-seminar-program","G&G 010","EarthResourcesEnergyand the Environment","TTh 11:35am-12:50pm","SC","fall"
"1436","freshman-seminar-program","GMAN 050","Spectatorship and Visual Culture","TTh 11:35am-12:50pm","not specified","fall"
"1437","freshman-seminar-program","HIST 007","History of U.S.–Latin American Relations","TTh 1pm-2:15pm","WR","fall"
"1438","freshman-seminar-program","HIST 022","What History Teaches","MW 9am-10:15am","WR","fall"
"1439","freshman-seminar-program","HIST 031","Political Islam","TTh 1pm-2:15pm","WR","spring"
"1440","freshman-seminar-program","HIST 038","The Mongols in China","TTh 2:30pm-3:45pm","WR","spring"
"1441","freshman-seminar-program","HIST 039","Mumbai: Life in a Megacity","TTh 1pm-2:15pm","WR","spring"
"1442","freshman-seminar-program","HIST 041","The Americas in the Age of Revolutions","TTh 11:35am-12:50pm","WR","fall"
"1443","freshman-seminar-program","HIST 042","Oil and Empire","TTh 1pm-2:15pm","WR","fall"
"1444","freshman-seminar-program","HLTH 081","Current Issues in Medicine and Public Health","TTh 1pm-2:15pm","not specified","fall"
"1445","freshman-seminar-program","HUMS 076","Epidemics in Global Perspective","MW 2:30pm-3:45pm","HU","fall"
"1446","freshman-seminar-program","HUMS 078","Shakespeare and Music","HTBA","HU","fall"
"1447","freshman-seminar-program","HUMS 092","Divine Law in Historical Perspective","HTBA","HU","spring"
"1448","freshman-seminar-program","LITR 017","Western Drama and Theater from 1400 to the Present","HTBA","not specified","fall"
"1449","freshman-seminar-program","MB&B 050","Topics in Cancer Biology","MW 1pm-2:15pm","SC","fall"
"1450","freshman-seminar-program","MCDB 040","The Science and Politics of Cancer","TTh 1pm-2:15pm","SC","spring"
"1451","freshman-seminar-program","MCDB 050","Immunology and Microbes","TTh 2:30pm-3:45pm","SC","fall"
"1452","freshman-seminar-program","MGRK 001","Western Visions of Greece","HTBA","HU","spring"
"1453","freshman-seminar-program","MGRK 002","Religion and Literature: Irreverent Texts","HTBA","HU","fall"
"1454","freshman-seminar-program","MUSI 009","Jazz and Architecture","TTh 11:35am-12:50pm","HU","fall"
"1455","freshman-seminar-program","MUSI 010","Music and Diplomacy","MW 2:30pm-3:45pm","HU","spring"
"1456","freshman-seminar-program","MUSI 012","One Thousand Years of Love Songs","TTh 1pm-2:15pm","HU","fall"
"1457","freshman-seminar-program","MUSI 030","Faith and Doubt in Western Music","TTh 11:35am-12:50pm","HU","spring"
"1458","freshman-seminar-program","NELC 001","Egypt and Northeast Africa: A Multidisciplinary Approach","MW 11:35am-12:50pm","WR","spring"
"1459","freshman-seminar-program","PHIL 084","Philosophy and Psychology of Emotion","TTh 1pm-2:15pm","HU","spring"
"1460","freshman-seminar-program","RLST 015","Gods and Heroes in Indian Religions","HTBA","not specified","spring"
"1461","freshman-seminar-program","SCIE 030","Current Topics in Science","HTBA","SC","fall"
"1462","freshman-seminar-program","SOCY 086","Chinese Society since Mao","TTh 2:30pm-3:45pm","SO","fall"
"1463","freshman-seminar-program","SPAN 060","Freshman Colloquium: Literary Studies in Spanish","MW 4pm-5:15pm","L5","fall"
"1464","freshman-seminar-program","WGSS 032","History of Sexuality","TTh 2:30pm-3:45pm","WR","spring"
"1465","womens-gender-sexuality-studies","WGSS 120","WomenFoodand Culture","TTh 1:30pm-2:20pm","SO","fall"
"1466","womens-gender-sexuality-studies","WGSS 200","U.S. Lesbian and Gay History","TTh 10:30am-11:20am","HU","fall"
"1467","womens-gender-sexuality-studies","WGSS 205","Bodies and PleasuresSex and Genders","W 2:30pm-4:20pm","SO","fall"
"1468","womens-gender-sexuality-studies","WGSS 206","Globalizing Gender and Sexuality","not listed","not specified","fall"
"1469","womens-gender-sexuality-studies","WGSS 340","Feminist and Queer Theory","W 3:30pm-5:20pm","WR","fall"
"1470","womens-gender-sexuality-studies","WGSS 398","Junior Seminar: Theory and Method","T 7pm-8:50pm","WR","spring"
"1471","womens-gender-sexuality-studies","WGSS 490","The Senior Colloquium","not listed","not specified","both"
"1472","womens-gender-sexuality-studies","WGSS 491","The Senior Essay","HTBA","not specified","both"
"1473","womens-gender-sexuality-studies","WGSS 032","History of Sexuality","TTh 2:30pm-3:45pm","WR","spring"
"1474","womens-gender-sexuality-studies","WGSS 110","Sex and Gender in Society","TTh 3:30pm-4:20pm","SO","fall"
"1475","womens-gender-sexuality-studies","WGSS 204","Feminist Theory and Feminist Art","T 3:30pm-5:20pm","HU","spring"
"1476","womens-gender-sexuality-studies","WGSS 211","Race and Gender in American Literature","TTh 11:35am-12:25pm","WR","spring"
"1477","womens-gender-sexuality-studies","WGSS 215","Modern Literature and the Eastern Mediterranean","HTBA","HU","fall"
"1478","womens-gender-sexuality-studies","WGSS 226","Lives in Ancient Egypt","HTBA","HU","spring"
"1479","womens-gender-sexuality-studies","WGSS 234","Disability and Culture","HTBA","SO","spring"
"1480","womens-gender-sexuality-studies","WGSS 299","SexKnowledgeand Power","TTh 10:30am-11:20am","SO","spring"
"1481","womens-gender-sexuality-studies","WGSS 306","Gender and Transgender","TTh 1pm-2:15pm","not specified","fall"
"1482","womens-gender-sexuality-studies","WGSS 308","Queer Ethnographies","HTBA","SO","spring"
"1483","womens-gender-sexuality-studies","WGSS 314","Social Movements","W 1:30pm-3:20pm","SO","fall"
"1484","womens-gender-sexuality-studies","WGSS 316","Inequality in America","T 9:25am-11:15am","WR","spring"
"1485","womens-gender-sexuality-studies","WGSS 317","Women in the Middle Ages","WF 11:35am-12:50pm","not specified","spring"
"1486","womens-gender-sexuality-studies","WGSS 327","Constructing the Self: From Autobiography to Facebook","T 1:30pm-3:20pm","WR","fall"
"1487","womens-gender-sexuality-studies","WGSS 328","Popular Culture and Postcolonial India","W 1:30pm-3:20pm","WR","fall"
"1488","womens-gender-sexuality-studies","WGSS 339","Fiction and Sexual Politics","TTh 11:35am-12:50pm","WR","spring"
"1489","womens-gender-sexuality-studies","WGSS 353","ModernismGenderand Sexuality in the Literature of World War I","WF 11:35am-12:50pm","WR","spring"
